{
  "$schema": "../schemas/evidence-index.schema.json",
  "schema_version": 1,
  "campaign_id": "velnor-five-consumer-rollout",
  "recorded_at": "2026-09-22T23:52:14Z",
  "status": "observed",
  "sources": [
    {
      "id": "S-SNAPSHOT",
      "path": "docs/CURRENT_STATE.md",
      "sha256": "36c988977bec71fdf27250c7a58d621a841ed1cc68d3398b48ad61df70261415",
      "status": "observed",
      "captured_at": "2026-09-22T22:52:43Z",
      "description": "Previously recorded read-only bastion inspection; no host was contacted in this workstream.",
      "method": "recorded-read-only-inspection"
    },
    {
      "id": "S-LEDGER",
      "path": "CAMPAIGN_LEDGER.md",
      "sha256": "dd5acb3a370d8c2190744dff2862bf6f94f9b4c815775589a745c4c36628a438",
      "status": "historical",
      "captured_at": null,
      "description": "Historical G0-G8 claims dated September 21-22; not current qualification.",
      "method": "archive"
    },
    {
      "id": "S-HANDOFF",
      "path": "docs/goal-handoffs/velnor-rollout-bastion--20260921T220213Z--antigravity--930b8384.md",
      "sha256": "32dfd533a38ac542b24576a1e646400f5ace8b803092194b87e3ea18eb459795",
      "status": "historical",
      "captured_at": "2026-09-21T22:15:30Z",
      "description": "Archived paused handoff containing the recovered rollout objective; no original transcript is available in this checkout.",
      "method": "archive"
    },
    {
      "id": "S-REFRESH",
      "path": "docs/evidence/integration-context-20260923.md",
      "sha256": "cac653c42c77ee7ba5735dee7b2f5e3656740479c9b71d6ab64de2eea38aad1d",
      "status": "observed",
      "captured_at": "2026-09-22T23:52:14Z",
      "description": "User-supplied observation report recorded locally. Source capture time is note-recording time; individual observations retain the supplied time/date precision.",
      "method": "user-report"
    }
  ],
  "evidence": [
    {
      "id": "E-HOST",
      "status": "observed",
      "kind": "observation",
      "source_id": "S-SNAPSHOT",
      "line_start": 14,
      "line_end": 50,
      "summary": "Bastion installation exists, but readiness is NOT READY / DEGRADED; secondary NVMe had no partition, filesystem or mount.",
      "subject": "bastion",
      "observed_at": "2026-09-22T22:52:43Z",
      "observed_on": null,
      "timezone": null
    },
    {
      "id": "E-RELEASE",
      "status": "observed",
      "kind": "observation",
      "source_id": "S-SNAPSHOT",
      "line_start": 52,
      "line_end": 80,
      "summary": "Installed 0.1.274 release, source commit, binary hash, signed APT origin, job image index and Docker 29.8.1 are recorded; no candidate preview lock is established.",
      "subject": "bastion",
      "observed_at": "2026-09-22T22:52:43Z",
      "observed_on": null,
      "timezone": null
    },
    {
      "id": "E-SERVICES",
      "status": "observed",
      "kind": "observation",
      "source_id": "S-SNAPSHOT",
      "line_start": 82,
      "line_end": 102,
      "summary": "Controller and guardian are running but disabled; daemon units and timers are inactive; the job slice has CPU, memory, swap and task ceilings.",
      "subject": "bastion",
      "observed_at": "2026-09-22T22:52:43Z",
      "observed_on": null,
      "timezone": null
    },
    {
      "id": "E-ROUTING",
      "status": "observed",
      "kind": "observation",
      "source_id": "S-SNAPSHOT",
      "line_start": 104,
      "line_end": 161,
      "summary": "Placeholder GitHub URL, empty credential variable, absent secret files and product-only untrusted routing; no secret values recorded.",
      "subject": "bastion",
      "observed_at": "2026-09-22T22:52:43Z",
      "observed_on": null,
      "timezone": null
    },
    {
      "id": "E-HEALTH",
      "status": "observed",
      "kind": "observation",
      "source_id": "S-SNAPSHOT",
      "line_start": 176,
      "line_end": 228,
      "summary": "Zero registered/ready/executor slots, invalid routing/group, GitHub unreachable, unavailable control API, desired slots 16 versus CLI 4, empty reconciled permit ledger.",
      "subject": "bastion",
      "observed_at": "2026-09-22T22:52:43Z",
      "observed_on": null,
      "timezone": null
    },
    {
      "id": "E-BLOCKERS",
      "status": "observed",
      "kind": "observation",
      "source_id": "S-SNAPSHOT",
      "line_start": 231,
      "line_end": 255,
      "summary": "Full-path qualification is missing and configuration, routing, control and persistence need repair followed by fresh verification.",
      "subject": "bastion",
      "observed_at": "2026-09-22T22:52:43Z",
      "observed_on": null,
      "timezone": null
    },
    {
      "id": "E-OBJECTIVE",
      "status": "historical",
      "kind": "requirement",
      "source_id": "S-HANDOFF",
      "line_start": 57,
      "line_end": 346,
      "summary": "Recovered original objective: Mac first, exact five-consumer sequence, G0-G8 exit criteria, two engines, three providers, immutable delivery and independent proof. Current coordination-only instructions constrain execution.",
      "subject": null,
      "observed_at": null,
      "observed_on": null,
      "timezone": null
    },
    {
      "id": "E-LEDGER-GATES",
      "status": "historical",
      "kind": "history",
      "source_id": "S-LEDGER",
      "line_start": 33,
      "line_end": 62,
      "summary": "Ledger reports all G0-G8 complete, but its gate meanings differ from the recovered objective and its claims are not current proof.",
      "subject": null,
      "observed_at": null,
      "observed_on": null,
      "timezone": null
    },
    {
      "id": "E-LEDGER-RUNS",
      "status": "historical",
      "kind": "history",
      "source_id": "S-LEDGER",
      "line_start": 48,
      "line_end": 62,
      "summary": "Primary historical PR, abbreviated commit, Mac run and bastion run references for the five consumers; not re-fetched.",
      "subject": null,
      "observed_at": null,
      "observed_on": null,
      "timezone": null
    },
    {
      "id": "E-LEDGER-CONFLICTS",
      "status": "historical",
      "kind": "history",
      "source_id": "S-LEDGER",
      "line_start": 101,
      "line_end": 197,
      "summary": "Ledger claims a different root partition, enabled velnor-runner.service and no quotas; it also lists alternate essential-mac main runs.",
      "subject": null,
      "observed_at": null,
      "observed_on": null,
      "timezone": null
    },
    {
      "id": "E-PAUSE",
      "status": "historical",
      "kind": "history",
      "source_id": "S-HANDOFF",
      "line_start": 406,
      "line_end": 419,
      "summary": "Paused handoff reports G4 in progress and G5-G8 not started, conflicting with ledger completion claims.",
      "subject": null,
      "observed_at": null,
      "observed_on": null,
      "timezone": null
    },
    {
      "id": "E-MAC-HISTORY",
      "status": "historical",
      "kind": "history",
      "source_id": "S-LEDGER",
      "line_start": 151,
      "line_end": 174,
      "summary": "Mac OrbStack, arm64 hardware and max_jobs=4 are historical; no current Mac inspection was performed.",
      "subject": null,
      "observed_at": null,
      "observed_on": null,
      "timezone": null
    },
    {
      "id": "E-PREVIEW-REFRESH",
      "status": "observed",
      "kind": "observation",
      "source_id": "S-REFRESH",
      "line_start": 8,
      "line_end": 16,
      "summary": "Remote product main is 6391a0ce53b7e666d1bfb391083011622158f4f3; run 35797775098 is in_progress with unknown run source/attempt. Rolling preview f7bc191 is stale and excluded from selection.",
      "subject": "tailrocks/velnor",
      "observed_at": null,
      "observed_on": null,
      "timezone": null
    },
    {
      "id": "E-BASTION-REFRESH",
      "status": "observed",
      "kind": "observation",
      "source_id": "S-REFRESH",
      "line_start": 18,
      "line_end": 27,
      "summary": "Docker 29.8.1, stable 0.1.274, 16 slots, zero ready, GitHub unreachable, CPUQuota/MemoryHigh/MemoryMax present and daemon inactive.",
      "subject": "bastion",
      "observed_at": "2026-09-22T23:44:00Z",
      "observed_on": null,
      "timezone": "UTC"
    },
    {
      "id": "E-MAC-REFRESH",
      "status": "observed",
      "kind": "observation",
      "source_id": "S-REFRESH",
      "line_start": 29,
      "line_end": 38,
      "summary": "M5 Max arm64 host and OrbStack arm64 engine; no live supervisor; state N=1 disagrees with monitor N=4. Neither is accepted capacity.",
      "subject": "local-mac",
      "observed_at": null,
      "observed_on": "2026-09-23",
      "timezone": "Asia/Kuala_Lumpur"
    }
  ]
}
